{
  "$schema": "https://json-schema.org/draft/2020-12/schema",
  "type": "object",
  "properties": {
    "name": {
      "type": "string",
      "minLength": 1,
      "maxLength": 60
    },
    "description": {
      "default": "",
      "type": "string",
      "maxLength": 120
    },
    "url": {
      "default": "",
      "anyOf": [
        {
          "type": "string",
          "pattern": "^https:\\/\\/",
          "format": "uri"
        },
        {
          "type": "string",
          "const": ""
        }
      ]
    },
    "twitter": {
      "default": "",
      "type": "string",
      "maxLength": 120
    },
    "discord": {
      "default": "",
      "type": "string",
      "maxLength": 200
    },
    "telegram": {
      "default": "",
      "type": "string",
      "maxLength": 200
    },
    "logo": {
      "default": "",
      "type": "string"
    },
    "categories": {
      "minItems": 1,
      "maxItems": 3,
      "type": "array",
      "items": {
        "type": "string",
        "enum": [
          "Agents",
          "Apps",
          "Bots",
          "Bridge",
          "Copytrade",
          "Data",
          "Developers",
          "Lending",
          "NFT",
          "Taxes",
          "Terminal",
          "Yield"
        ]
      },
      "uniqueItems": true
    },
    "instances": {
      "default": [
        "Lighter Core"
      ],
      "minItems": 1,
      "type": "array",
      "items": {
        "type": "string",
        "enum": [
          "Lighter Core",
          "Lighter Robinhood"
        ]
      }
    },
    "status": {
      "default": "Live",
      "type": "string",
      "enum": [
        "Live",
        "Not Live",
        "Paused"
      ]
    },
    "createdAt": {
      "default": "1970-01-01",
      "type": "string",
      "pattern": "^\\d{4}-\\d{2}-\\d{2}$"
    },
    "official": {
      "default": false,
      "type": "boolean"
    },
    "acceleratePartner": {
      "type": "boolean"
    },
    "builderDiscords": {
      "maxItems": 10,
      "type": "array",
      "items": {
        "type": "string",
        "minLength": 2,
        "maxLength": 37
      }
    },
    "integrator_account_index": {
      "anyOf": [
        {
          "anyOf": [
            {
              "type": "integer",
              "minimum": 0,
              "maximum": 9007199254740991
            },
            {
              "type": "string",
              "pattern": "^\\d+$"
            }
          ]
        },
        {
          "minItems": 1,
          "type": "array",
          "items": {
            "anyOf": [
              {
                "type": "integer",
                "minimum": 0,
                "maximum": 9007199254740991
              },
              {
                "type": "string",
                "pattern": "^\\d+$"
              }
            ]
          }
        }
      ]
    },
    "robinhood_integrator_account_index": {
      "anyOf": [
        {
          "anyOf": [
            {
              "type": "integer",
              "minimum": 0,
              "maximum": 9007199254740991
            },
            {
              "type": "string",
              "pattern": "^\\d+$"
            }
          ]
        },
        {
          "minItems": 1,
          "type": "array",
          "items": {
            "anyOf": [
              {
                "type": "integer",
                "minimum": 0,
                "maximum": 9007199254740991
              },
              {
                "type": "string",
                "pattern": "^\\d+$"
              }
            ]
          }
        }
      ]
    },
    "longDescription": {
      "type": "string",
      "maxLength": 4000
    },
    "demoUrl": {
      "anyOf": [
        {
          "type": "string",
          "pattern": "^https:\\/\\/",
          "format": "uri"
        },
        {
          "type": "string",
          "const": ""
        }
      ]
    },
    "demoImage": {
      "type": "string",
      "maxLength": 500
    },
    "demoVideo": {
      "anyOf": [
        {
          "type": "string",
          "pattern": "^https:\\/\\/",
          "format": "uri"
        },
        {
          "type": "string",
          "pattern": "^\\/demos\\/[a-zA-Z0-9/_-]+\\.mp4$"
        },
        {
          "type": "string",
          "const": ""
        }
      ]
    },
    "hiring": {
      "type": "boolean"
    },
    "hiringContact": {
      "type": "object",
      "properties": {
        "channel": {
          "type": "string",
          "enum": [
            "twitter",
            "email",
            "discord",
            "telegram"
          ]
        },
        "handle": {
          "type": "string",
          "minLength": 1,
          "maxLength": 120
        }
      },
      "required": [
        "channel",
        "handle"
      ]
    },
    "team": {
      "maxItems": 20,
      "type": "array",
      "items": {
        "type": "object",
        "properties": {
          "name": {
            "type": "string",
            "minLength": 1,
            "maxLength": 80
          },
          "role": {
            "default": "",
            "type": "string",
            "maxLength": 80
          },
          "avatar": {
            "default": "",
            "type": "string",
            "maxLength": 500
          },
          "twitter": {
            "default": "",
            "type": "string",
            "maxLength": 200
          }
        },
        "required": [
          "name"
        ]
      }
    },
    "announcements": {
      "maxItems": 50,
      "type": "array",
      "items": {
        "type": "object",
        "properties": {
          "id": {
            "default": "",
            "type": "string",
            "maxLength": 60
          },
          "title": {
            "default": "",
            "type": "string",
            "maxLength": 160
          },
          "body": {
            "default": "",
            "type": "string",
            "maxLength": 2000
          },
          "date": {
            "default": "",
            "type": "string",
            "maxLength": 40
          },
          "url": {
            "default": "",
            "anyOf": [
              {
                "type": "string",
                "pattern": "^https:\\/\\/",
                "format": "uri"
              },
              {
                "type": "string",
                "const": ""
              }
            ]
          }
        }
      }
    },
    "updates": {
      "maxItems": 50,
      "type": "array",
      "items": {
        "type": "object",
        "properties": {
          "id": {
            "default": "",
            "type": "string",
            "maxLength": 60
          },
          "version": {
            "default": "",
            "type": "string",
            "maxLength": 40
          },
          "title": {
            "type": "string",
            "minLength": 1,
            "maxLength": 160
          },
          "body": {
            "default": "",
            "type": "string",
            "maxLength": 2000
          },
          "date": {
            "default": "",
            "type": "string",
            "maxLength": 40
          }
        },
        "required": [
          "title"
        ]
      }
    },
    "jobs": {
      "maxItems": 30,
      "type": "array",
      "items": {
        "type": "object",
        "properties": {
          "id": {
            "default": "",
            "type": "string",
            "maxLength": 60
          },
          "title": {
            "type": "string",
            "minLength": 1,
            "maxLength": 120
          },
          "type": {
            "default": "",
            "type": "string",
            "maxLength": 60
          },
          "location": {
            "default": "",
            "type": "string",
            "maxLength": 80
          },
          "salary": {
            "default": "",
            "type": "string",
            "maxLength": 80
          },
          "description": {
            "default": "",
            "type": "string",
            "maxLength": 1000
          },
          "applyUrl": {
            "default": "",
            "type": "string",
            "maxLength": 500
          }
        },
        "required": [
          "title"
        ]
      }
    },
    "robinhood_account_index": {
      "anyOf": [
        {
          "anyOf": [
            {
              "type": "integer",
              "minimum": 0,
              "maximum": 9007199254740991
            },
            {
              "type": "string",
              "pattern": "^\\d+$"
            }
          ]
        },
        {
          "minItems": 1,
          "type": "array",
          "items": {
            "anyOf": [
              {
                "type": "integer",
                "minimum": 0,
                "maximum": 9007199254740991
              },
              {
                "type": "string",
                "pattern": "^\\d+$"
              }
            ]
          }
        }
      ]
    }
  },
  "required": [
    "name",
    "categories"
  ],
  "$comment": "Generated by builders-hub/scripts/export-project-schema.ts. Do not edit by hand."
}
