{
  "name": "Vooi",
  "description": "Trade crypto and RWA perps with one balance, zero gas, and no bridges. VOOI V2 brings CEX-grade UX to decentralized…",
  "url": "https://vooi.io/",
  "twitter": "",
  "logo": "/logos/vooi_logo.png",
  "categories": [
    "Apps"
  ],
  "status": "Live",
  "createdAt": "2026-06-05",
  "official": false,
  "integrator_account_index": "132230",
  "robinhood_integrator_account_index": "1578"
}
