{
  "name": "Lighter MCP by Senya",
  "description": "Lighter MCP: trade Lighter perp DEX from your agent -- read market data, balances & positions, paper & live orders.",
  "url": "https://github.com/iamgoatedaf?tab=repositories",
  "twitter": "",
  "discord": "",
  "telegram": "",
  "logo": "",
  "categories": [
    "Developers"
  ],
  "status": "Live",
  "official": false
}
