{
  "name": "Alpha Journey",
  "description": "Trading journal focused on strategy/analytics/automation",
  "url": "https://alphajourney.app",
  "twitter": "@AlphaJourneyApp",
  "discord": "https://discord.gg/UErM2wRXc",
  "telegram": "",
  "logo": "/logos/alpha-journey_logo.jpg",
  "categories": [
    "Data",
    "Apps"
  ],
  "instances": [
    "Lighter Core"
  ],
  "status": "Live",
  "createdAt": "2026-09-24",
  "official": false,
  "builderDiscords": [
    "alpha_journey"
  ],
  "longDescription": "Alpha Journey auto-syncs your Lighter trades and turns them into a strategy-driven journal. Define your setups and risk rules, and get alerts when you drift off-plan or a strategy starts losing its edge.\n\nNot just for analyzing your edge, but for improving and finding it!"
}
