{
  "name": "Minara AI",
  "description": "Your personal AI agent for trading stocks, commodities, crypto, pre-IPO equity.",
  "url": "https://minara.ai/",
  "twitter": "https://x.com/minara",
  "discord": "https://discord.com/invite/minaraai",
  "telegram": "",
  "logo": "/logos/minara-ai_logo.png",
  "categories": [
    "Agents",
    "Bots"
  ],
  "status": "Live",
  "createdAt": "2026-06-05",
  "official": false,
  "integrator_account_index": [
    "724857",
    "724927",
    "750521",
    "755668"
  ]
}
