{
  "name": "Brighter’s listing",
  "description": "Earn money from Brighter airdrop ",
  "url": "https://brighter.money/dashboard",
  "twitter": "@arainboyx",
  "discord": "",
  "telegram": "",
  "logo": "/logos/brighter-s-listing_logo.png",
  "categories": [
    "Copytrade",
    "Agents"
  ],
  "status": "Live",
  "createdAt": "2026-07-14",
  "official": false
}
