{
  "name": "Perpetuals.WTF",
  "description": "Launch tokens with built-in perpetual strategies.",
  "url": "https://www.perpetuals.wtf/",
  "twitter": "https://x.com/PerpetualsWTF",
  "discord": "",
  "telegram": "",
  "logo": "/logos/perpetuals-wtf_logo.png",
  "categories": [
    "Apps"
  ],
  "status": "Live",
  "createdAt": "2026-09-11",
  "official": false,
  "builderDiscords": [
    "0xtax"
  ]
}
