{
  "name": "LEV7",
  "description": "Trade the MAG7 together with leverage",
  "url": "https://lev7.finance",
  "twitter": "@lev7finance",
  "discord": "",
  "telegram": "@lev7finance",
  "logo": "/logos/lev7_logo.svg",
  "categories": [
    "Apps"
  ],
  "status": "Not Live",
  "createdAt": "2026-08-19",
  "official": false,
  "builderDiscords": [
    "hllev7_45349"
  ]
}
