{
  "name": "Solvana AI ",
  "description": "One Interface. Any Chain. AI intent engine automating smart routing for spot, perps, and advanced limit order",
  "url": "https://solvana.ai",
  "twitter": "https://x.com/solvana_ai",
  "discord": "http://discord.gg/gVfSHuymKM",
  "telegram": "https://t.me/solvana_ai",
  "logo": "/logos/solvana-ai_logo.jpg",
  "categories": [
    "Agents",
    "Bots"
  ],
  "status": "Live",
  "createdAt": "2026-07-21",
  "official": false,
  "builderDiscords": [
    "saurabhkartik"
  ],
  "instances": [
    "Lighter Core"
  ],
  "integrator_account_index": 92873,
  "longDescription": "Solvana AI brings intelligent perpetual trading on Lighter through a unified execution layer. Users can trade Lighter perpetuals directly from X via tweets, or through the Solvana web app in a secure environment. Solvana’s intelligence layer understands user intent, analyzes the market, and helps execute perpetual trades on Lighter through simple natural-language commands.",
  "demoUrl": "https://youtu.be/CBAgKDdFKto",
  "team": [
    {
      "name": "Saurabh Kartik",
      "role": "Founder",
      "avatar": "",
      "twitter": "Saurabhkartik07"
    }
  ]
}
