{
  "name": "Blockworks",
  "description": "Lighter Analytics",
  "url": "https://blockworks.com/analytics/lighter",
  "twitter": "@blockworks",
  "discord": "",
  "telegram": "",
  "logo": "/logos/blockworks_logo.png",
  "categories": [
    "Data"
  ],
  "status": "Live",
  "createdAt": "2026-06-05",
  "official": false
}
