{
  "name": "Origami.tech",
  "description": "Build and run automated crypto trading strategies across CEXes and DEXes with a low-code, non-custodial platform…",
  "url": "https://origami.tech/",
  "twitter": "https://x.com/origamitech_",
  "logo": "/logos/origami-tech_logo.svg",
  "categories": [
    "Terminal"
  ],
  "status": "Live",
  "createdAt": "2026-06-05",
  "official": false,
  "integrator_account_index": 720463,
  "discord": "https://discord.gg/origamitech",
  "telegram": "https://t.me/origami_tech",
  "instances": [
    "Lighter Core"
  ]
}
