{
  "name": "LighterStatsX",
  "description": "",
  "url": "https://www.lighterstatsx.xyz/",
  "twitter": "https://x.com/LighterLiq",
  "logo": "/logos/lighterstatsx_logo.svg",
  "categories": [
    "Data"
  ],
  "status": "Live",
  "createdAt": "2026-06-05",
  "official": false,
  "discord": "",
  "telegram": "",
  "instances": [
    "Lighter Core"
  ]
}
