{
  "name": "Metascalp",
  "description": "Pro trading terminal for 20+ exchanges, with real-time order-book depth and clusters",
  "url": "https://app.metascalp.io/",
  "twitter": "https://x.com/metascalp",
  "discord": "",
  "telegram": "@metascalp_io",
  "logo": "/logos/metascalp_logo.svg",
  "categories": [
    "Terminal",
    "Data"
  ],
  "status": "Live",
  "createdAt": "2026-06-15",
  "official": false,
  "integrator_account_index": "725564"
}
